"","text","favorited","favoriteCount","replyToSN","created","truncated","replyToSID","id","replyToUID","statusSource","screenName","retweetCount","isRetweet","retweeted","longitude","latitude","date","time"
"1","Oh good, @megabus getting on ""lets pretend we're an airline"" bandwagon &amp; hassling ppl 4 bag weight. Time to find better way to/from Toronto.",FALSE,0,NA,2016-04-29 15:46:13,FALSE,NA,"726075122092625920",NA,"<a href=""http://twitter.com/download/iphone"" rel=""nofollow"">Twitter for iPhone</a>","aaronsaloman",0,FALSE,FALSE,NA,NA,"2016-04-29","15:46:13"
"2","think I'd die of shock if I ever got a megabus n it wasn't delayed at least an hour",FALSE,0,NA,2016-04-29 15:42:37,FALSE,NA,"726074215703654400",NA,"<a href=""http://twitter.com/download/iphone"" rel=""nofollow"">Twitter for iPhone</a>","alexaaknowles",0,FALSE,FALSE,NA,NA,"2016-04-29","15:42:37"
"3","the megabus is my second home",FALSE,2,NA,2016-04-29 15:39:59,FALSE,NA,"726073550982012928",NA,"<a href=""http://twitter.com/download/iphone"" rel=""nofollow"">Twitter for iPhone</a>","frickingdiamond",0,FALSE,FALSE,NA,NA,"2016-04-29","15:39:59"
"4","@megabus Hi so I believe that I didn't get the experience or service I paid for. I'm on a knockoff brand bus for some unknown reason.",FALSE,0,"megabus",2016-04-29 15:32:07,FALSE,NA,"726071573807960064","30965315","<a href=""http://twitter.com/download/iphone"" rel=""nofollow"">Twitter for iPhone</a>","daucko12",0,FALSE,FALSE,NA,NA,"2016-04-29","15:32:07"
"5","@MichelleDBeadle Why don't you jump on MegaBus to the ATL and head to Dega with  us Sunday @TalladegaSuperS",FALSE,0,"MichelleDBeadle",2016-04-29 15:29:33,FALSE,NA,"726070926647824384","52529345","<a href=""http://twitter.com/download/android"" rel=""nofollow"">Twitter for Android</a>","ATLcoxbaby",0,FALSE,FALSE,NA,NA,"2016-04-29","15:29:33"
"6","@Cash_Mohney @DorotheaLasky @morbidanatomy @JSTOR go! NY IS A $50 megabus ticket away.",FALSE,0,"Cash_Mohney",2016-04-29 15:26:49,FALSE,"724708659264118784","726070241403490308","746615383","<a href=""http://twitter.com/download/iphone"" rel=""nofollow"">Twitter for iPhone</a>","MMTague",0,FALSE,FALSE,NA,NA,"2016-04-29","15:26:49"
"7","obviously man got the megabus with no plugs or wifi...",FALSE,0,NA,2016-04-29 15:17:58,FALSE,NA,"726068010541322241",NA,"<a href=""http://twitter.com/download/android"" rel=""nofollow"">Twitter for Android</a>","iamkloc",0,FALSE,FALSE,NA,NA,"2016-04-29","15:17:58"
"8","@megabus please be good to me Ì†ΩÌ∏≠ seems like I'm gonna be traveling a long way with y'all. Like 18+ hours one way Ì†ΩÌ∫å",FALSE,0,"megabus",2016-04-29 15:15:43,FALSE,NA,"726067447032225792","30965315","<a href=""http://twitter.com/download/iphone"" rel=""nofollow"">Twitter for iPhone</a>","MeghanSimone_xo",0,FALSE,FALSE,NA,NA,"2016-04-29","15:15:43"
"9","And so Everton away begins. On the megabus. Send best wishes my way...",FALSE,0,NA,2016-04-29 15:11:04,FALSE,NA,"726066277954019329",NA,"<a href=""http://twitter.com/download/iphone"" rel=""nofollow"">Twitter for iPhone</a>","ryanbmuff",0,FALSE,FALSE,NA,NA,"2016-04-29","15:11:04"
"10","my megabus is late and ive run out of drink and im not feeling too great. i really need ice cream Ì†ºÌΩ¶ when i get off this. still 15mins away.",FALSE,0,NA,2016-04-29 15:09:19,FALSE,NA,"726065835224256512",NA,"<a href=""http://twitter.com/download/android"" rel=""nofollow"">Twitter for Android</a>","kissakerho",0,FALSE,FALSE,NA,NA,"2016-04-29","15:09:19"
"11","Dillinger Four were totally worth being hungover on a megabus for, which is fuckin saying something.",FALSE,0,NA,2016-04-29 15:08:58,FALSE,NA,"726065745860386816",NA,"<a href=""http://twitter.com/download/android"" rel=""nofollow"">Twitter for Android</a>","Johniscool88",0,FALSE,FALSE,NA,NA,"2016-04-29","15:08:58"
"12","@lolJESS_kidding @GreyhoundBus hey at least you're not using @megabus anymore",FALSE,1,"lolJESS_kidding",2016-04-29 15:06:42,FALSE,"726038399447121920","726065177964204032","570483152","<a href=""http://twitter.com/download/iphone"" rel=""nofollow"">Twitter for iPhone</a>","__meeks_",0,FALSE,FALSE,NA,NA,"2016-04-29","15:06:42"
"13","@megabusuk e.g. from Munich: https://t.co/4CvmW2UV6t Ì†ΩÌ∏é #megabusde #MUCBRU",FALSE,1,"megabusuk",2016-04-29 15:05:48,FALSE,"726063708640792576","726064950339342340","210765002","<a href=""http://twitter.com/download/iphone"" rel=""nofollow"">Twitter for iPhone</a>","megabusde",1,FALSE,FALSE,NA,NA,"2016-04-29","15:05:48"
"14","@barrygoldblatt God bless Spirit's glorified sky Megabus.",FALSE,0,"barrygoldblatt",2016-04-29 15:05:11,FALSE,"726064178767761409","726064797419208706","34476699","<a href=""http://twitter.com"" rel=""nofollow"">Twitter Web Client</a>","BBolander",0,FALSE,FALSE,NA,NA,"2016-04-29","15:05:11"
"15","Where's next on your list? 
We're thinking #Brussels https://t.co/mHYM8huCn8 #travel https://t.co/FrVgKfQQcA",FALSE,3,NA,2016-04-29 15:00:52,FALSE,NA,"726063708640792576",NA,"<a href=""http://www.hootsuite.com"" rel=""nofollow"">Hootsuite</a>","megabusuk",1,FALSE,FALSE,NA,NA,"2016-04-29","15:00:52"
"16","Very scared of getting the Megabus",FALSE,0,NA,2016-04-29 15:00:33,FALSE,NA,"726063627413950465",NA,"<a href=""http://twitter.com"" rel=""nofollow"">Twitter Web Client</a>","CallumHuthwaite",0,FALSE,FALSE,NA,NA,"2016-04-29","15:00:33"
"17","The megabus never fails to reek of a giant hoagie",FALSE,0,NA,2016-04-29 15:00:02,FALSE,NA,"726063497440845824",NA,"<a href=""http://twitter.com/download/iphone"" rel=""nofollow"">Twitter for iPhone</a>","MiMiRusso1",0,FALSE,FALSE,NA,NA,"2016-04-29","15:00:02"
"18","@megabusuk hi, any idea how late the megabus from East Midlands Parkway to York is?",FALSE,0,"megabusuk",2016-04-29 14:53:15,FALSE,NA,"726061791416037376","210765002","<a href=""http://twitter.com/download/iphone"" rel=""nofollow"">Twitter for iPhone</a>","ChrissieBits",0,FALSE,FALSE,NA,NA,"2016-04-29","14:53:15"
"19","@JohnstoneFrazer what about that megabus? Ì†ΩÌ∏Ç",FALSE,0,"JohnstoneFrazer",2016-04-29 14:44:54,FALSE,"726058504788824064","726059689801322496","604517543","<a href=""http://twitter.com/download/iphone"" rel=""nofollow"">Twitter for iPhone</a>","Chris_Evans99",0,FALSE,FALSE,NA,NA,"2016-04-29","14:44:54"
"20","Tryna go to ATL in June for the low low...help!!! What's the best way...MegaBus, Greyhound?",FALSE,1,NA,2016-04-29 14:28:54,FALSE,NA,"726055664519401472",NA,"<a href=""http://twitter.com/download/android"" rel=""nofollow"">Twitter for Android</a>","hypekyzeta",0,FALSE,FALSE,NA,NA,"2016-04-29","14:28:54"
"21","Depends..... What are the chances the bus catches on fire and I lose all my belongings?  https://t.co/dPSE6Sc8a2",FALSE,0,NA,2016-04-29 14:22:32,FALSE,NA,"726054061003284480",NA,"<a href=""http://twitter.com/download/iphone"" rel=""nofollow"">Twitter for iPhone</a>","pcarney16",0,FALSE,FALSE,NA,NA,"2016-04-29","14:22:32"
"22","@fireproofsoph I thought coaches are cheaper like megabus is pretty cheap and yeah true because your from Scotland aren't ya??",FALSE,0,"fireproofsoph",2016-04-29 14:13:15,FALSE,"726051228841590786","726051723991760896","2360843067","<a href=""http://twitter.com/download/iphone"" rel=""nofollow"">Twitter for iPhone</a>","nialltours",0,FALSE,FALSE,NA,NA,"2016-04-29","14:13:15"
"23","Arrived bang on time, great trip down, so easy and so cheap! I'll be using @megabus again",FALSE,0,NA,2016-04-29 14:05:11,FALSE,NA,"726049696494575617",NA,"<a href=""http://www.twitter.com"" rel=""nofollow"">Twitter for Windows Phone</a>","lydstime",0,FALSE,FALSE,NA,NA,"2016-04-29","14:05:11"
"24","Every time I get the megabus between London and Newcastle I regret it every time. Yet here I am again....",FALSE,0,NA,2016-04-29 14:04:12,FALSE,NA,"726049450314047489",NA,"<a href=""http://twitter.com/download/iphone"" rel=""nofollow"">Twitter for iPhone</a>","KatyFawcett123",0,FALSE,FALSE,NA,NA,"2016-04-29","14:04:12"
"25","It's so hot on this Megabus the guy in front of me's hair is getting greasier every minute",FALSE,0,NA,2016-04-29 14:02:50,FALSE,NA,"726049105261285380",NA,"<a href=""http://twitter.com/download/iphone"" rel=""nofollow"">Twitter for iPhone</a>","jessdwi",0,FALSE,FALSE,NA,NA,"2016-04-29","14:02:50"
"26","@CaCaz174 @megabus It's can be hard to predict how long the bus will take when the traffic is moving so slowly. Hopefully it'll make up time",FALSE,0,"CaCaz174",2016-04-29 14:01:49,FALSE,"726047269393453060","726048847538061312","2776620725","<a href=""http://www.hootsuite.com"" rel=""nofollow"">Hootsuite</a>","megabusuk",0,FALSE,FALSE,NA,NA,"2016-04-29","14:01:49"
"27","@megabusuk @megabus yes sorry. Bus has just arrived, very late and limited comms from attendant on stand.",FALSE,0,"megabusuk",2016-04-29 13:55:32,FALSE,"726047048068374528","726047269393453060","210765002","<a href=""http://twitter.com/download/android"" rel=""nofollow"">Twitter for Android</a>","CaCaz174",0,FALSE,FALSE,NA,NA,"2016-04-29","13:55:32"
"28","@CaCaz174 @megabus We don't have a 12:10 bus from Birmingham to Manchester, do you mean 14:10?",FALSE,0,"CaCaz174",2016-04-29 13:54:40,FALSE,"726043147554410496","726047048068374528","2776620725","<a href=""http://www.hootsuite.com"" rel=""nofollow"">Hootsuite</a>","megabusuk",0,FALSE,FALSE,NA,NA,"2016-04-29","13:54:40"
"29","Shout out to megabus for being half an hour lateÌ†ΩÌ≤ï",FALSE,0,NA,2016-04-29 13:53:51,FALSE,NA,"726046842153218048",NA,"<a href=""http://twitter.com/download/android"" rel=""nofollow"">Twitter for Android</a>","Lvcifer__",0,FALSE,FALSE,NA,NA,"2016-04-29","13:53:51"
"30","this megabus driver talks too much I think he's bored lol",FALSE,1,NA,2016-04-29 13:53:44,FALSE,NA,"726046814093348864",NA,"<a href=""http://twitter.com/download/iphone"" rel=""nofollow"">Twitter for iPhone</a>","ImaniTsunami",0,FALSE,FALSE,NA,NA,"2016-04-29","13:53:44"
"31","Missing your megabus by a minute Ì†ΩÌπÇÌ†ΩÌπÇ #justsarathings",FALSE,7,NA,2016-04-29 13:49:53,FALSE,NA,"726045847373357056",NA,"<a href=""http://twitter.com/download/iphone"" rel=""nofollow"">Twitter for iPhone</a>","senorita_sarraa",0,FALSE,FALSE,NA,NA,"2016-04-29","13:49:53"
"32","Did someone really just start clapping when the megabus pulled into the station, it's bad enough on easyjet cmon",FALSE,2,NA,2016-04-29 13:49:28,FALSE,NA,"726045738724110338",NA,"<a href=""http://twitter.com/download/iphone"" rel=""nofollow"">Twitter for iPhone</a>","ellieIngerland",0,FALSE,FALSE,NA,NA,"2016-04-29","13:49:28"
"33","@megabus 2.10 even",FALSE,0,"CaCaz174",2016-04-29 13:40:00,FALSE,"726043147554410496","726043358460780544","2776620725","<a href=""http://twitter.com/download/android"" rel=""nofollow"">Twitter for Android</a>","CaCaz174",0,FALSE,FALSE,NA,NA,"2016-04-29","13:40:00"
"34","@megabus where is 12.10 Birmingham to Manchester bus? Very cold people hanging  around on Hill Street now.",FALSE,0,"megabus",2016-04-29 13:39:10,FALSE,NA,"726043147554410496","30965315","<a href=""http://twitter.com/download/android"" rel=""nofollow"">Twitter for Android</a>","CaCaz174",0,FALSE,FALSE,NA,NA,"2016-04-29","13:39:10"
"35","@fineskylark like its cramped as it is on the megabus so I could do without your sweaty self taking up room ty",FALSE,0,"fineskylark",2016-04-29 13:37:53,FALSE,"726037777322807297","726042824274284544","175775259","<a href=""http://twitter.com/download/iphone"" rel=""nofollow"">Twitter for iPhone</a>","fineskylark",0,FALSE,FALSE,NA,NA,"2016-04-29","13:37:53"
"36","Trying to astral project on the megabus",FALSE,2,NA,2016-04-29 13:35:56,FALSE,NA,"726042333070893056",NA,"<a href=""http://twitter.com/download/iphone"" rel=""nofollow"">Twitter for iPhone</a>","syddabon",0,FALSE,FALSE,NA,NA,"2016-04-29","13:35:56"
"37","@Dlewis92Lewis Sorry to hear that. If you can tell me which megabus journey then I may be able to track the vehicle",FALSE,0,"Dlewis92Lewis",2016-04-29 13:35:34,FALSE,"726041831180492801","726042243707052036","2255464407","<a href=""http://www.hootsuite.com"" rel=""nofollow"">Hootsuite</a>","megabusuk",0,FALSE,FALSE,NA,NA,"2016-04-29","13:35:34"
"38","A packed megabus is not what I wanna be stuck on when I'm this hungoverÌ†ΩÌ∏∑",FALSE,1,NA,2016-04-29 13:32:44,FALSE,NA,"726041528716632064",NA,"<a href=""http://twitter.com/download/iphone"" rel=""nofollow"">Twitter for iPhone</a>","BryonyNicholson",0,FALSE,FALSE,NA,NA,"2016-04-29","13:32:44"
"39","Is it madness to travel to Glasgow from London by overnight Megabus? Sorry, Megabus 'Gold'? I'm high maintenance but also, stingy.",FALSE,1,NA,2016-04-29 13:30:18,FALSE,NA,"726040916520259584",NA,"<a href=""http://twitter.com"" rel=""nofollow"">Twitter Web Client</a>","DJAFrankenstein",0,FALSE,FALSE,NA,NA,"2016-04-29","13:30:18"
"40","Tip Sheet: The pros and cons of Megabus travel - https://t.co/AZR2PrVySR",FALSE,0,NA,2016-04-29 13:26:42,FALSE,NA,"726040009468481536",NA,"<a href=""http://www.rssground.com/"" rel=""nofollow"">RSSGround</a>","hostalworld",0,FALSE,FALSE,NA,NA,"2016-04-29","13:26:42"
"41","@oliviafrd Iv never stepped foot on a megabus n never will Omg lol",FALSE,0,"oliviafrd",2016-04-29 13:23:31,FALSE,"726039105788850176","726039209253953540","2932195090","<a href=""http://twitter.com/download/iphone"" rel=""nofollow"">Twitter for iPhone</a>","olivia_csk",0,FALSE,FALSE,NA,NA,"2016-04-29","13:23:31"
"42","Fine scran in Mother India this evening. Cheap whisky in coke bottles on the Megabus to Aberdeen tomorrow. The sublime to the ridiculous.",FALSE,1,NA,2016-04-29 13:20:19,FALSE,NA,"726038406774534144",NA,"<a href=""http://twitter.com"" rel=""nofollow"">Twitter Web Client</a>","libertinejay",0,FALSE,FALSE,NA,NA,"2016-04-29","13:20:19"
"43","@gapwriter i was riding the @megabus yesterday and saw other cars passing me on the road... people texting &amp; driving &amp; having conversations+",FALSE,0,"gapwriter",2016-04-29 13:14:22,FALSE,"726034096779059200","726036908577423360","103682558","<a href=""http://twitter.com"" rel=""nofollow"">Twitter Web Client</a>","misskimari",0,FALSE,FALSE,NA,NA,"2016-04-29","13:14:22"
"44","@megabusuk is the 2.20 Megabus from Newcastle to London on time?",FALSE,0,"megabusuk",2016-04-29 13:06:10,FALSE,NA,"726034845063860224","210765002","<a href=""http://twitter.com/download/iphone"" rel=""nofollow"">Twitter for iPhone</a>","EmelyeFerguson",0,FALSE,FALSE,NA,NA,"2016-04-29","13:06:10"
"45","Venturing to the city that never sleeps for the weekend! Ì†ΩÌ∫çÌ†ΩÌ∑ΩÌ†ΩÌπåÌ†ºÌøª #megabus #NYC",FALSE,1,NA,2016-04-29 12:56:30,FALSE,NA,"726032409314115584",NA,"<a href=""http://twitter.com/download/iphone"" rel=""nofollow"">Twitter for iPhone</a>","sasspants07",0,FALSE,FALSE,NA,NA,"2016-04-29","12:56:30"
"46","And now i‚Äôm on a bus at 5 AM headed down to #LA for the weekend. Don‚Äôt worry Mom- it‚Äôs a #megabus, not a #greyhound #classylikethat",FALSE,0,NA,2016-04-29 12:56:18,FALSE,NA,"726032361582907394",NA,"<a href=""http://www.hootsuite.com"" rel=""nofollow"">Hootsuite</a>","gloganvlog",0,FALSE,FALSE,NA,NA,"2016-04-29","12:56:18"
"47","And now i‚Äôm on a bus at 5 AM headed down to #LA for the weekend. Don‚Äôt worry Mom- it‚Äôs a #megabus, not a #greyhound #classylikethat",FALSE,0,NA,2016-04-29 12:56:18,FALSE,NA,"726032361448726528",NA,"<a href=""http://www.hootsuite.com"" rel=""nofollow"">Hootsuite</a>","gadrianrandall",0,FALSE,FALSE,NA,NA,"2016-04-29","12:56:18"
"48","Megabus to Toulouse is ¬£2 return like legit baggage and everything... but the coach journey is almost 28 hours...",FALSE,0,NA,2016-04-29 12:53:03,FALSE,NA,"726031544058535936",NA,"<a href=""http://twitter.com"" rel=""nofollow"">Twitter Web Client</a>","JadeWindle3",0,FALSE,FALSE,NA,NA,"2016-04-29","12:53:03"
"49","Megabus is a great place to make chitchat.",FALSE,2,NA,2016-04-29 12:49:48,FALSE,NA,"726030723837222912",NA,"<a href=""http://twitter.com/download/iphone"" rel=""nofollow"">Twitter for iPhone</a>","syddabon",0,FALSE,FALSE,NA,NA,"2016-04-29","12:49:48"
"50","If there's ever an Olympics for pissing while on a Megabus, I'll get a gold medal. No small feat, that. #branding",FALSE,2,NA,2016-04-29 12:46:30,FALSE,NA,"726029894388486144",NA,"<a href=""http://twitter.com/download/iphone"" rel=""nofollow"">Twitter for iPhone</a>","bionicbigfoot",0,FALSE,FALSE,NA,NA,"2016-04-29","12:46:30"
"51","Can't wait to remember that I was listening to ""Grammys"" by @Drake &amp; @1future on a Megabus to Boston, when I'm en route to the 2023 Grammys",FALSE,0,NA,2016-04-29 12:40:03,FALSE,NA,"726028271331250177",NA,"<a href=""http://twitter.com/download/android"" rel=""nofollow"">Twitter for Android</a>","runnn_JMC",0,FALSE,FALSE,NA,NA,"2016-04-29","12:40:03"
"52","There's an older couple boozing it up before getting on the Megabus and they're singing Hakuna Matata together. What a wonderful phrase.",FALSE,0,NA,2016-04-29 12:28:52,FALSE,NA,"726025458819698688",NA,"<a href=""http://twitter.com/download/iphone"" rel=""nofollow"">Twitter for iPhone</a>","ldmcphee",0,FALSE,FALSE,NA,NA,"2016-04-29","12:28:52"
"53","Yeah ok so some people have private jets, but my Megabus journey cost me 90p so who's the real winner here Ì†ΩÌπãÌ†ºÌøºÌ†ΩÌ∏Ç",FALSE,2,NA,2016-04-29 12:20:39,FALSE,NA,"726023390386069504",NA,"<a href=""http://twitter.com/download/iphone"" rel=""nofollow"">Twitter for iPhone</a>","amyjolly_",0,FALSE,FALSE,NA,NA,"2016-04-29","12:20:39"
"54","CCTV footage of alleged stabbing on Megabus played to court of...: CCTV footage of an alleged murder bid on b... https://t.co/Zi0QB04S3q",FALSE,0,NA,2016-04-29 12:19:16,FALSE,NA,"726023039977021442",NA,"<a href=""http://twitterfeed.com"" rel=""nofollow"">twitterfeed</a>","ILoveGlosUK",0,FALSE,FALSE,NA,NA,"2016-04-29","12:19:16"
"55","how can megabus make any money when they charge ¬£2",FALSE,0,NA,2016-04-29 12:14:26,FALSE,NA,"726021823301824514",NA,"<a href=""http://twitter.com/download/iphone"" rel=""nofollow"">Twitter for iPhone</a>","carlyslaejepsen",0,FALSE,FALSE,NA,NA,"2016-04-29","12:14:26"
"56","CCTV footage of alleged stabbing on Megabus played to court of... https://t.co/NhyMyU6kbt #Gloucestershire",FALSE,0,NA,2016-04-29 12:05:08,FALSE,NA,"726019484645892096",NA,"<a href=""http://dlvr.it"" rel=""nofollow"">dlvr.it</a>","DailyGLOUCESTER",0,FALSE,FALSE,"-2.27672976","51.88913974","2016-04-29","12:05:08"
"57","Why @megabus is a safe, budget-friendly #roadtrip alternative https://t.co/qaiD4SIL05 #travel #ad https://t.co/r6JoFUQNIw by @backroadplanet",FALSE,3,NA,2016-04-29 12:02:27,FALSE,NA,"726018809367289856",NA,"<a href=""http://www.hootsuite.com"" rel=""nofollow"">Hootsuite</a>","RyanBiddulph",0,FALSE,FALSE,NA,NA,"2016-04-29","12:02:27"
"58","This ride back to VT on the megabus should be a blast Ì†ΩÌ∏∑",FALSE,0,NA,2016-04-29 11:57:06,FALSE,NA,"726017462345584640",NA,"<a href=""http://twitter.com/download/iphone"" rel=""nofollow"">Twitter for iPhone</a>","KaraSantaw",0,FALSE,FALSE,NA,NA,"2016-04-29","11:57:06"
"59","This article is perfect to show why we need to #ProtectSmallClaims! https://t.co/HXDxBtvtLl https://t.co/kosUeyhHiD",FALSE,0,NA,2016-04-29 11:50:13,FALSE,NA,"726015728550350848",NA,"<a href=""http://bufferapp.com"" rel=""nofollow"">Buffer</a>","Jigsaw_Law",0,FALSE,FALSE,NA,NA,"2016-04-29","11:50:13"
"60","Cackling at the clown motel episode of @kateleth's @LTLCast in a full megabus. been saving these for travels &amp; its perfect Ì†ΩÌ±å",FALSE,0,NA,2016-04-29 11:45:14,FALSE,NA,"726014474461798400",NA,"<a href=""http://twitter.com/download/android"" rel=""nofollow"">Twitter for Android</a>","kissakerho",0,FALSE,FALSE,NA,NA,"2016-04-29","11:45:14"
"61","CCTV footage of alleged stabbing on Megabus played to court of school children
https://t.co/nAE4pOGlSh https://t.co/6BdmK1lI7X",FALSE,0,NA,2016-04-29 11:39:42,FALSE,NA,"726013085803266048",NA,"<a href=""https://about.twitter.com/products/tweetdeck"" rel=""nofollow"">TweetDeck</a>","GlosEcho",0,FALSE,FALSE,NA,NA,"2016-04-29","11:39:42"
"62","Here goes nothing. 

3am Megabus to Chicago then to Shanghai-Kunming-Chiang Mai. 
#Spacebag‚Ä¶ https://t.co/t8pXE4Dxdd",FALSE,0,NA,2016-04-29 11:15:55,FALSE,NA,"726007100342587392",NA,"<a href=""http://instagram.com"" rel=""nofollow"">Instagram</a>","corysever",0,FALSE,FALSE,NA,NA,"2016-04-29","11:15:55"
"63","Megabus to France is ¬£2 more expensive than a return to Kettering",FALSE,2,NA,2016-04-29 10:42:58,FALSE,NA,"725998805141823489",NA,"<a href=""http://twitter.com"" rel=""nofollow"">Twitter Web Client</a>","Nathe__",0,FALSE,FALSE,NA,NA,"2016-04-29","10:42:58"
"64","got to my megabus way too early, major tactical error",FALSE,0,NA,2016-04-29 10:34:07,FALSE,NA,"725996577349836800",NA,"<a href=""http://twitter.com/download/iphone"" rel=""nofollow"">Twitter for iPhone</a>","CateCarrejo",0,FALSE,FALSE,NA,NA,"2016-04-29","10:34:07"
"65","@rtv6 @megabus 4th accident in Indiana in 4 years? At least they're consistent.",FALSE,0,"rtv6",2016-04-29 10:29:30,FALSE,"725866692132397056","725995417289261056","14408705","<a href=""http://twitter.com/download/iphone"" rel=""nofollow"">Twitter for iPhone</a>","NomieApp",0,FALSE,FALSE,NA,NA,"2016-04-29","10:29:30"
"66","on the megabus now. fingers crossed no one sits next to me. they'll get elbows cos I'm gonna crochet obvs. (not as bad as me knitting tho)",FALSE,1,NA,2016-04-29 10:25:05,FALSE,NA,"725994307497410562",NA,"<a href=""http://twitter.com/download/android"" rel=""nofollow"">Twitter for Android</a>","kissakerho",0,FALSE,FALSE,NA,NA,"2016-04-29","10:25:05"
"67","Hello it is 6:30am and I am riding your megabus.",FALSE,3,NA,2016-04-29 10:21:05,FALSE,NA,"725993297311846400",NA,"<a href=""http://twitter.com/download/iphone"" rel=""nofollow"">Twitter for iPhone</a>","syddabon",0,FALSE,FALSE,NA,NA,"2016-04-29","10:21:05"
"68","American Airlines feeling like a winged Megabus rn. I don't remember it being this janky.",FALSE,5,NA,2016-04-29 10:20:24,FALSE,NA,"725993128172376064",NA,"<a href=""http://twitter.com/download/iphone"" rel=""nofollow"">Twitter for iPhone</a>","donwill",0,FALSE,FALSE,NA,NA,"2016-04-29","10:20:24"
"69","I currently have the most pressed megabus driver ever.",FALSE,0,NA,2016-04-29 10:17:06,FALSE,NA,"725992297360416769",NA,"<a href=""http://twitter.com/download/iphone"" rel=""nofollow"">Twitter for iPhone</a>","ImaniTsunami",0,FALSE,FALSE,NA,NA,"2016-04-29","10:17:06"
"70","Praying for a megabus with plugs",FALSE,1,NA,2016-04-29 10:05:03,FALSE,NA,"725989265218396161",NA,"<a href=""http://twitter.com/download/iphone"" rel=""nofollow"">Twitter for iPhone</a>","Caitlinwoods",0,FALSE,FALSE,NA,NA,"2016-04-29","10:05:03"
"71","Convo between megabus drivers: ""what's this big building by yur"" ""Isn't it that nasteral history museum?"" My life is in these hands #Despair",FALSE,1,NA,2016-04-29 10:04:19,FALSE,NA,"725989081856000001",NA,"<a href=""http://twitter.com/download/iphone"" rel=""nofollow"">Twitter for iPhone</a>","donohuuge",0,FALSE,FALSE,NA,NA,"2016-04-29","10:04:19"
"72","@Alienscum I just looked up train tickets it's like ¬£100 from here fuck.....come on megabus lets get sickening",FALSE,0,"Alienscum",2016-04-29 09:57:08,FALSE,"725986312336056320","725987270457737217","35377853","<a href=""http://twitter.com"" rel=""nofollow"">Twitter Web Client</a>","nickelbacklovr",0,FALSE,FALSE,NA,NA,"2016-04-29","09:57:08"
"73","guys i can take the megabus to atlanta and miami WHY DIDNT ANYBODY TELL ME",FALSE,0,NA,2016-04-29 09:56:48,FALSE,NA,"725987187603345408",NA,"<a href=""http://twitter.com/download/iphone"" rel=""nofollow"">Twitter for iPhone</a>","dogsruIe",0,FALSE,FALSE,NA,NA,"2016-04-29","09:56:48"
"74","Every time I get the megabus the are bare free seats and yet people choose the seat next to me",FALSE,0,NA,2016-04-29 09:53:09,FALSE,NA,"725986271353552896",NA,"<a href=""http://twitter.com/download/iphone"" rel=""nofollow"">Twitter for iPhone</a>","MattBunker96",0,FALSE,FALSE,NA,NA,"2016-04-29","09:53:09"
"75","@megabus Your bus driver refused to turn down air conditioning fan ... Traveling to New Orleans at 4am. Temperature inside: 60 deg F",FALSE,0,"megabus",2016-04-29 09:48:11,FALSE,NA,"725985018955194369","30965315","<a href=""http://twitter.com/download/iphone"" rel=""nofollow"">Twitter for iPhone</a>","j4nwar",0,FALSE,FALSE,NA,NA,"2016-04-29","09:48:11"
"76","Counting down T-minus 1.5 more hours on the #Megabus and I will be in #Atlanta.",FALSE,2,NA,2016-04-29 09:34:19,FALSE,NA,"725981528010825728",NA,"<a href=""http://twitter.com/download/android"" rel=""nofollow"">Twitter for Android</a>","kate_adair",1,FALSE,FALSE,NA,NA,"2016-04-29","09:34:19"
"77","Excited to see my illustration on a bottle tonight at @PissedModernism. Not so excited to be a megabus right now.",FALSE,4,NA,2016-04-29 09:14:20,FALSE,NA,"725976500282003456",NA,"<a href=""http://twitter.com/download/iphone"" rel=""nofollow"">Twitter for iPhone</a>","Sophie3141",2,FALSE,FALSE,NA,NA,"2016-04-29","09:14:20"
"78","Look forward to boarding the Megabus and heading for home this afternoon.",FALSE,1,NA,2016-04-29 09:08:34,FALSE,NA,"725975049434484736",NA,"<a href=""http://twitter.com/download/android"" rel=""nofollow"">Twitter for Android</a>","DaveWongWales",0,FALSE,FALSE,NA,NA,"2016-04-29","09:08:34"
"79","On my way to work, I saw the @megabus, involved in crash in downtown #Indy, being hitched to a wrecker. 1 person was hurt in crash. @rtv6",FALSE,4,NA,2016-04-29 08:42:11,FALSE,NA,"725968408400023552",NA,"<a href=""http://twitter.com"" rel=""nofollow"">Twitter Web Client</a>","MarcMullins1",1,FALSE,FALSE,NA,NA,"2016-04-29","08:42:11"
"80","U know wen U were a 2nd former &amp; EVERYONE senior would kick you out your seat? Think I just inadvertently did that to someone on the Megabus",FALSE,1,NA,2016-04-29 08:02:25,FALSE,NA,"725958404439683072",NA,"<a href=""http://twitter.com/download/iphone"" rel=""nofollow"">Twitter for iPhone</a>","waynesanders1",0,FALSE,FALSE,NA,NA,"2016-04-29","08:02:25"
