"","text","favorited","favoriteCount","replyToSN","created","truncated","replyToSID","id","replyToUID","statusSource","screenName","retweetCount","isRetweet","retweeted","longitude","latitude","date","time"
"1426","When megabus blesses you with free wifi Ì†ΩÌπåÌ†ºÌøª",FALSE,0,NA,2016-04-22 16:33:28,FALSE,NA,"723550298200006656",NA,"<a href=""http://twitter.com/download/iphone"" rel=""nofollow"">Twitter for iPhone</a>","bfleming16",0,FALSE,FALSE,NA,NA,"2016-04-22","16:33:28"
"1427","Happy Earth Day #Megabus",FALSE,0,NA,2016-04-22 16:29:00,FALSE,NA,"723549173438648320",NA,"<a href=""http://twitter.com/download/iphone"" rel=""nofollow"">Twitter for iPhone</a>","IHateAlliNoto",0,FALSE,FALSE,NA,NA,"2016-04-22","16:29:00"
"1428","@megabusuk therefore I missed my tube to my end destination, a megabus representative told us we can get a full refund",FALSE,0,"megabusuk",2016-04-22 16:27:29,FALSE,NA,"723548791056543745","210765002","<a href=""http://twitter.com/#!/download/ipad"" rel=""nofollow"">Twitter for iPad</a>","stefangumbs",0,FALSE,FALSE,NA,NA,"2016-04-22","16:27:29"
"1429","@megabus you guys let me down smh",FALSE,0,"megabus",2016-04-22 16:27:23,FALSE,NA,"723548767652339712","30965315","<a href=""http://www.handmark.com"" rel=""nofollow"">TweetCaster for iOS</a>","andreaverdel",0,FALSE,FALSE,NA,NA,"2016-04-22","16:27:23"
"1430","that's megabus for you",FALSE,0,"cupsoflouis",2016-04-22 16:23:30,FALSE,"607641046315638785","723547789796474880","23238005","<a href=""http://twitter.com"" rel=""nofollow"">Twitter Web Client</a>","cupsoflouis",0,FALSE,FALSE,NA,NA,"2016-04-22","16:23:30"
"1431","I hate taking the Megabus. I can't sleep on the floor, I can't sleep on my seat partner, my bus box isn't under my seat. Where is my bus god",FALSE,2,NA,2016-04-22 16:21:36,FALSE,NA,"723547309401866240",NA,"<a href=""http://twitter.com/download/android"" rel=""nofollow"">Twitter for Android</a>","KittyLickLick76",0,FALSE,FALSE,NA,NA,"2016-04-22","16:21:36"
"1432","Drinking on this megabus, making plans to meet friends in NY, thinkin bout seeing Hamilton again. Everything is good",FALSE,1,NA,2016-04-22 16:17:42,FALSE,NA,"723546329876684800",NA,"<a href=""http://twitter.com/download/iphone"" rel=""nofollow"">Twitter for iPhone</a>","IHateAlliNoto",1,FALSE,FALSE,NA,NA,"2016-04-22","16:17:42"
"1433","Transit from Toronto to Cornwall https://t.co/k4SniGzI1i https://t.co/Kv1d3BYP2o",FALSE,0,NA,2016-04-22 16:15:39,FALSE,NA,"723545814862315520",NA,"<a href=""http://www.facebook.com/twitter"" rel=""nofollow"">Facebook</a>","KamaWright",0,FALSE,FALSE,NA,NA,"2016-04-22","16:15:39"
"1434","is it just me or does the megabus time table now suck unbelievably? wtf is going on there? seriously. you can't get a day trip now?",FALSE,0,NA,2016-04-22 16:14:59,FALSE,NA,"723545646226124800",NA,"<a href=""http://twitter.com"" rel=""nofollow"">Twitter Web Client</a>","whittamore",0,FALSE,FALSE,NA,NA,"2016-04-22","16:14:59"
"1435","@megabusuk are you discontinuing megabus train service from Nottingham to London? From what date if so, please?",FALSE,0,"megabusuk",2016-04-22 16:11:23,FALSE,NA,"723544739405029376","210765002","<a href=""http://twitter.com"" rel=""nofollow"">Twitter Web Client</a>","esfairel",0,FALSE,FALSE,NA,NA,"2016-04-22","16:11:23"
"1436","farting on the megabus",FALSE,8,NA,2016-04-22 16:09:48,FALSE,NA,"723544342976180225",NA,"<a href=""http://twitter.com/download/iphone"" rel=""nofollow"">Twitter for iPhone</a>","NEDARBNAGROM",2,FALSE,FALSE,NA,NA,"2016-04-22","16:09:48"
"1437","So old ladies can get crunk on beer &amp; wine on the megabus now?  I'm just counting down the clock for the tears and vomit...",FALSE,0,NA,2016-04-22 16:09:43,FALSE,NA,"723544322692370435",NA,"<a href=""http://twitter.com/download/iphone"" rel=""nofollow"">Twitter for iPhone</a>","polkahauntsus",0,FALSE,FALSE,NA,NA,"2016-04-22","16:09:43"
"1438","why am i currently in the world's longest line for megabus",FALSE,1,NA,2016-04-22 16:02:58,FALSE,NA,"723542620002201600",NA,"<a href=""http://twitter.com/download/iphone"" rel=""nofollow"">Twitter for iPhone</a>","lachiclionne",0,FALSE,FALSE,NA,NA,"2016-04-22","16:02:58"
"1439","@megabus Where is your policy on mobile phone use on your services?",FALSE,0,"megabus",2016-04-22 15:56:53,FALSE,NA,"723541089488003072","30965315","<a href=""https://mobile.twitter.com"" rel=""nofollow"">Mobile Web (M5)</a>","milly444",0,FALSE,FALSE,NA,NA,"2016-04-22","15:56:53"
"1440","People on the megabus pretending to be asleep so you can have the whole 2 seat to yourself 1) I hate you 2) I wish I thought of that",FALSE,1,NA,2016-04-22 15:41:45,FALSE,NA,"723537282737811457",NA,"<a href=""http://twitter.com/download/iphone"" rel=""nofollow"">Twitter for iPhone</a>","JoeRobertCollin",0,FALSE,FALSE,NA,NA,"2016-04-22","15:41:45"
"1441","When you see a thirumeni on the side of the road and give him a ride to the megabus station Lolol #whatislife Ì†ΩÌ≤í",FALSE,22,NA,2016-04-22 15:34:53,FALSE,NA,"723535556186017796",NA,"<a href=""http://twitter.com/download/iphone"" rel=""nofollow"">Twitter for iPhone</a>","susankurian35",0,FALSE,FALSE,NA,NA,"2016-04-22","15:34:53"
"1442","Oh shit someone took off they shoes on megabus",FALSE,45,NA,2016-04-22 15:25:37,FALSE,NA,"723533223909707776",NA,"<a href=""http://twitter.com/download/iphone"" rel=""nofollow"">Twitter for iPhone</a>","AAANTWON",4,FALSE,FALSE,NA,NA,"2016-04-22","15:25:37"
"1443","#Foodporn After a 7hr bus ride on #MegaBus arrived in #WestOakland with some serious rain coming‚Ä¶ https://t.co/ZFQLYZU2DK",FALSE,0,NA,2016-04-22 15:21:08,FALSE,NA,"723532092332613636",NA,"<a href=""http://instagram.com"" rel=""nofollow"">Instagram</a>","KimaShines",0,FALSE,FALSE,NA,NA,"2016-04-22","15:21:08"
"1444","It's a small world. I'm waiting for the megabus with my Monroe jacket on and this dude asked me if I go there and said he graduated 2012 Ì†ΩÌ∏ÇÌ†ΩÌ∏Ç",FALSE,0,NA,2016-04-22 15:17:37,FALSE,NA,"723531207972106241",NA,"<a href=""http://twitter.com/download/iphone"" rel=""nofollow"">Twitter for iPhone</a>","ChefPreddie",0,FALSE,FALSE,NA,NA,"2016-04-22","15:17:37"
"1445","@EMTrains ...if I'd bought them via your megabus site I wouldn't have even needed a bit of paper. Annoyed and disappointed.",FALSE,0,"EMTrains",2016-04-22 15:05:19,FALSE,NA,"723528114660323330","16795011","<a href=""http://twitter.com"" rel=""nofollow"">Twitter Web Client</a>","Cr8tveBarnsley",0,FALSE,FALSE,NA,NA,"2016-04-22","15:05:19"
"1446","On my way to NYC!! #Passover #LongWeekend @ MegaBus at 30th Street Station https://t.co/ghCus8Y2QB",FALSE,0,NA,2016-04-22 15:04:56,FALSE,NA,"723528015586664448",NA,"<a href=""http://instagram.com"" rel=""nofollow"">Instagram</a>","phillygirlmich",0,FALSE,FALSE,"-75.18551286","39.95613538","2016-04-22","15:04:56"
"1447","Like you called him too, he didnt pick up but like he came 7p and didnt apologize for shit. Yeah... Fuck megabus.",FALSE,0,NA,2016-04-22 15:03:29,FALSE,NA,"723527653140127744",NA,"<a href=""http://twitter.com/download/iphone"" rel=""nofollow"">Twitter for iPhone</a>","IAMSLOTA",0,FALSE,FALSE,NA,NA,"2016-04-22","15:03:29"
"1448","Megabus is like your uncle who you talked to over the phone about hanging out but @ 1p came on you chilled on the stoop for 5 hours waiting",FALSE,1,NA,2016-04-22 15:02:51,FALSE,NA,"723527492565368832",NA,"<a href=""http://twitter.com/download/iphone"" rel=""nofollow"">Twitter for iPhone</a>","IAMSLOTA",0,FALSE,FALSE,NA,NA,"2016-04-22","15:02:51"
"1449","I've seen everything from toenail clippers to LARPers throughout my megabus days, but I'm having an especially hard time grappling with this",FALSE,2,"_carostran",2016-04-22 15:01:41,FALSE,"723525899895902208","723527199924596736","702798734858518528","<a href=""http://twitter.com/download/iphone"" rel=""nofollow"">Twitter for iPhone</a>","_carostran",0,FALSE,FALSE,NA,NA,"2016-04-22","15:01:41"
"1450","There's a couple sitting across from me popping what looks like an expensive bottle of champagne... on the megabus... Ì†ΩÌ∏ì",FALSE,2,NA,2016-04-22 14:56:31,FALSE,NA,"723525899895902208",NA,"<a href=""http://twitter.com/download/iphone"" rel=""nofollow"">Twitter for iPhone</a>","_carostran",0,FALSE,FALSE,NA,NA,"2016-04-22","14:56:31"
"1451","@megabusuk Hi! Going EDI-LDN next week. Can I put a bike in the luggage hold? Or book it in? Can't see anything here https://t.co/exLLmRyr9Q",FALSE,0,"megabusuk",2016-04-22 14:40:10,FALSE,NA,"723521785027801090","210765002","<a href=""http://twitter.com/download/iphone"" rel=""nofollow"">Twitter for iPhone</a>","MichaelMacLeod1",0,FALSE,FALSE,NA,NA,"2016-04-22","14:40:10"
"1452","my iPod would stop working the day before a Megabus journey to London wouldn't it",FALSE,1,NA,2016-04-22 14:39:24,FALSE,NA,"723521592223997953",NA,"<a href=""http://twitter.com"" rel=""nofollow"">Twitter Web Client</a>","worndowntoys",0,FALSE,FALSE,NA,NA,"2016-04-22","14:39:24"
"1453","@megabus then today I speak to a rep named John expecting to be refunded for my trip because of my experience",FALSE,0,"megabus",2016-04-22 14:38:02,FALSE,NA,"723521249050243072","30965315","<a href=""http://twitter.com/download/iphone"" rel=""nofollow"">Twitter for iPhone</a>","loubanger",0,FALSE,FALSE,NA,NA,"2016-04-22","14:38:02"
"1454","Them 5 hour megabus essentials https://t.co/6ZEFb8sSnN",FALSE,1,NA,2016-04-22 14:37:19,FALSE,NA,"723521068594507777",NA,"<a href=""http://twitter.com/download/iphone"" rel=""nofollow"">Twitter for iPhone</a>","spc95",0,FALSE,FALSE,NA,NA,"2016-04-22","14:37:19"
"1455","Since WHEN are you allowed to smoke on a @megabus. Protip: YOU'RE NOT. How inconsiderate, a**hole. Ì†ΩÌπÖÌ†ºÌøªÌ†ΩÌπÖÌ†ºÌøªÌ†ΩÌπÖÌ†ºÌøªÌ†ΩÌπÖÌ†ºÌøªÌ†ΩÌπÖÌ†ºÌøªÌ†ΩÌπÖÌ†ºÌøª",FALSE,2,NA,2016-04-22 14:27:11,FALSE,NA,"723518518013005825",NA,"<a href=""http://twitter.com/download/iphone"" rel=""nofollow"">Twitter for iPhone</a>","erikasentz",0,FALSE,FALSE,NA,NA,"2016-04-22","14:27:11"
"1456","We're planting 10k trees across the US in honor of our 10 year anniversary! https://t.co/2E6y38OEaM #MegabusTurns10 https://t.co/5fQUt5J2Cq",FALSE,62,NA,2016-04-22 14:23:52,FALSE,NA,"723517683573116928",NA,"<a href=""http://www.hootsuite.com"" rel=""nofollow"">Hootsuite</a>","megabus",9,FALSE,FALSE,NA,NA,"2016-04-22","14:23:52"
"1457","When the entire megabus stops so the driver can pee. #no",FALSE,0,NA,2016-04-22 14:15:36,FALSE,NA,"723515600304242689",NA,"<a href=""http://twitter.com/download/iphone"" rel=""nofollow"">Twitter for iPhone</a>","bachochrek",0,FALSE,FALSE,NA,NA,"2016-04-22","14:15:36"
"1458","@megabus not to mention helping move luggage from one bus to another &amp; to top things off I was about 2 and a half hour to state college",FALSE,0,"megabus",2016-04-22 14:11:08,FALSE,NA,"723514477812035584","30965315","<a href=""http://twitter.com/download/iphone"" rel=""nofollow"">Twitter for iPhone</a>","loubanger",0,FALSE,FALSE,NA,NA,"2016-04-22","14:11:08"
"1459","My first #MegaBus Experience has been pretty uneventful thus far! I'm glad cause I've heard horror stories!",FALSE,1,NA,2016-04-22 14:06:12,FALSE,NA,"723513237682196480",NA,"<a href=""http://twitter.com/download/android"" rel=""nofollow"">Twitter for Android</a>","Yet_Still_IRise",0,FALSE,FALSE,NA,NA,"2016-04-22","14:06:12"
"1460","I'm in Philly I could literally buy these tickets at the box office and take a megabus there and back. Fuck me up",FALSE,0,NA,2016-04-22 13:59:51,FALSE,NA,"723511637387403265",NA,"<a href=""http://twitter.com/download/iphone"" rel=""nofollow"">Twitter for iPhone</a>","JoeyArectumKels",0,FALSE,FALSE,NA,NA,"2016-04-22","13:59:51"
"1461","So I had a negative experience yesterday whit @megabus bus broke down on i80 towards state college waiting over a hour for another bus smh",FALSE,0,NA,2016-04-22 13:57:06,FALSE,NA,"723510946526822401",NA,"<a href=""http://twitter.com/download/iphone"" rel=""nofollow"">Twitter for iPhone</a>","loubanger",0,FALSE,FALSE,NA,NA,"2016-04-22","13:57:06"
"1462","@MayaIndigo_ @ParysAkira @megabus happened to me before. i was supposed to arrive at 1am, got home at like 2:30.",FALSE,1,"MayaIndigo_",2016-04-22 13:43:24,FALSE,"723505836664954880","723507500423766016","56473709","<a href=""http://twitter.com/download/iphone"" rel=""nofollow"">Twitter for iPhone</a>","zvhirXX",0,FALSE,FALSE,NA,NA,"2016-04-22","13:43:24"
"1463","#birmingham #victoriasquare @ Megabus Stop Hill Street Birmingham https://t.co/q7U8DdZmZY",FALSE,0,NA,2016-04-22 13:39:44,FALSE,NA,"723506575500029952",NA,"<a href=""http://instagram.com"" rel=""nofollow"">Instagram</a>","Xi0Y3iZ",0,FALSE,FALSE,"-1.90236884","52.4785465","2016-04-22","13:39:44"
"1464","Sitting in the front seat on the top floor of Megabus blasting Nine Inch Nails and feeling very Mad Max. Ì†æÌ¥ò https://t.co/8BJELdsU3Z",FALSE,3,NA,2016-04-22 13:38:58,FALSE,NA,"723506384831143938",NA,"<a href=""http://twitter.com/download/iphone"" rel=""nofollow"">Twitter for iPhone</a>","ameliasmps",0,FALSE,FALSE,NA,NA,"2016-04-22","13:38:58"
"1465","Greyhound is where it's at. Always on time, their outlets usually always work &amp; wifi too. Megabus just don't be caring at all lol.",FALSE,6,"MayaIndigo_",2016-04-22 13:37:40,FALSE,"723505836664954880","723506057860014081","56473709","<a href=""http://twitter.com/download/iphone"" rel=""nofollow"">Twitter for iPhone</a>","MayaIndigo_",0,FALSE,FALSE,NA,NA,"2016-04-22","13:37:40"
"1466","I'm so done. Cheap rates don't matter if I feel unsafe and my trip ain't on time. This'll be my last Megabus ride. https://t.co/1bvGGegV2m",FALSE,0,NA,2016-04-22 13:37:37,FALSE,NA,"723506043821674501",NA,"<a href=""http://twitter.com/download/iphone"" rel=""nofollow"">Twitter for iPhone</a>","ParysAkira",0,FALSE,FALSE,NA,NA,"2016-04-22","13:37:37"
"1467","This is exactly why I stopped using megabus. I've heard of this happening way too many times.  https://t.co/4b3WEGMd2h",FALSE,0,NA,2016-04-22 13:36:48,FALSE,NA,"723505836664954880",NA,"<a href=""http://twitter.com/download/iphone"" rel=""nofollow"">Twitter for iPhone</a>","MayaIndigo_",1,FALSE,FALSE,NA,NA,"2016-04-22","13:36:48"
"1468","So this @Megabus had us on the side of the road for 2 hours making the arrival 2+ hours late and now my entire schedule is ruined Ì†ΩÌ∏í",FALSE,0,NA,2016-04-22 13:35:11,FALSE,NA,"723505430459244545",NA,"<a href=""http://twitter.com/download/iphone"" rel=""nofollow"">Twitter for iPhone</a>","ParysAkira",0,FALSE,FALSE,NA,NA,"2016-04-22","13:35:11"
"1469","Become an ambassador for @megabus this Fall! Check out information about their amazing PAID program!  https://t.co/sh2v6tzvRu",FALSE,4,NA,2016-04-22 13:01:41,FALSE,NA,"723497001153888257",NA,"<a href=""http://www.hootsuite.com"" rel=""nofollow"">Hootsuite</a>","InternQueen",0,FALSE,FALSE,NA,NA,"2016-04-22","13:01:41"
"1470","Megabus lines are so confusing",FALSE,0,NA,2016-04-22 12:51:56,FALSE,NA,"723494547804794881",NA,"<a href=""http://twitter.com/download/iphone"" rel=""nofollow"">Twitter for iPhone</a>","JoeyArectumKels",0,FALSE,FALSE,NA,NA,"2016-04-22","12:51:56"
"1471","Why do I always get tired when I travel on a Megabus?",FALSE,0,NA,2016-04-22 12:48:08,FALSE,NA,"723493589850968065",NA,"<a href=""http://twitter.com/download/android"" rel=""nofollow"">Twitter for Android</a>","elliotleaver92",0,FALSE,FALSE,NA,NA,"2016-04-22","12:48:08"
"1472","When the megabus driver tells you that you are too loud. But you ain't making a sound Ì†ΩÌ∏ÇÌ†ΩÌ∏ÇÌ†ΩÌ∏ÇÌ†ΩÌ∏óÌ†ΩÌ≤®",FALSE,1,NA,2016-04-22 12:35:53,FALSE,NA,"723490507570196480",NA,"<a href=""http://twitter.com/download/android"" rel=""nofollow"">Twitter for Android</a>","iamowenrogers",0,FALSE,FALSE,NA,NA,"2016-04-22","12:35:53"
"1473","Getting a seat to myself on the megabus is a great start to this weekend Ì†ΩÌ±åÌ†ºÌøª",FALSE,0,NA,2016-04-22 12:32:05,FALSE,NA,"723489550685900800",NA,"<a href=""http://twitter.com/download/iphone"" rel=""nofollow"">Twitter for iPhone</a>","stephwenner",0,FALSE,FALSE,NA,NA,"2016-04-22","12:32:05"
"1474","Getting a five and a half hour megabus to London because dating is hard.",FALSE,3,NA,2016-04-22 12:20:33,FALSE,NA,"723486651008311297",NA,"<a href=""http://twitter.com/download/android"" rel=""nofollow"">Twitter for Android</a>","hannahtheplatt",0,FALSE,FALSE,NA,NA,"2016-04-22","12:20:33"
"1475","Megabus driver is late and I really need to piss ‚òπÔ∏è",FALSE,0,NA,2016-04-22 12:11:03,FALSE,NA,"723484259537793025",NA,"<a href=""http://twitter.com/download/iphone"" rel=""nofollow"">Twitter for iPhone</a>","Bmurdog",0,FALSE,FALSE,NA,NA,"2016-04-22","12:11:03"
"1476","MegaBus trip to Dallas art museums
2016-04-23 11:15:00
https://t.co/VPPDBpxKby https://t.co/fZ3LiNDNoZ",FALSE,0,NA,2016-04-22 12:00:11,FALSE,NA,"723481525115723776",NA,"<a href=""http://www.yohobby.com"" rel=""nofollow"">YoHobby</a>","YoHobbySA",0,FALSE,FALSE,NA,NA,"2016-04-22","12:00:11"
"1477","@_max_warren_ on my megabus I watched 30 rock and then fell asleep and drooled all over my self????",FALSE,2,"_max_warren_",2016-04-22 11:55:27,FALSE,"723473013547655168","723480332851359744","3972368763","<a href=""http://twitter.com/download/iphone"" rel=""nofollow"">Twitter for iPhone</a>","Twowhitecranes",0,FALSE,FALSE,NA,NA,"2016-04-22","11:55:27"
"1478","When you thought you could get loads of writing done, but you're stuck on a megabus with no working plug socket Ì†ΩÌ∏î",FALSE,0,NA,2016-04-22 11:29:04,FALSE,NA,"723473691863060480",NA,"<a href=""http://twitter.com/download/android"" rel=""nofollow"">Twitter for Android</a>","EvieHicks93",0,FALSE,FALSE,NA,NA,"2016-04-22","11:29:04"
"1479","if I'm not there by half wait for 15mins nyana cos (megabus) or call me, don't whatsapp me https://t.co/sPCO53J1x9",FALSE,0,NA,2016-04-22 11:28:22,FALSE,NA,"723473517031874560",NA,"<a href=""http://twitter.com"" rel=""nofollow"">Twitter Web Client</a>","surbZ_MX",0,FALSE,FALSE,NA,NA,"2016-04-22","11:28:22"
"1480","how can i glam up the megabus trip to london to make it a suitable carriage to lust for youth??",FALSE,7,NA,2016-04-22 11:26:22,FALSE,NA,"723473013547655168",NA,"<a href=""http://twitter.com"" rel=""nofollow"">Twitter Web Client</a>","_max_warren_",0,FALSE,FALSE,NA,NA,"2016-04-22","11:26:22"
"1481","@JiggyFilms greyhound or megabus that bitch. Hit street show on venice &amp; rack up lol",FALSE,0,"JiggyFilms",2016-04-22 11:25:50,FALSE,"723472653416165376","723472877912096768","26458596","<a href=""http://twitter.com/download/android"" rel=""nofollow"">Twitter for Android</a>","TFxSINGEN",0,FALSE,FALSE,NA,NA,"2016-04-22","11:25:50"
"1482","#megabus is celebrating its 10th anniversary by planting 10,000 trees on #EarthDay https://t.co/2kvMFpTA6X https://t.co/hXQg61NXlq",FALSE,2,NA,2016-04-22 11:05:11,FALSE,NA,"723467680649457664",NA,"<a href=""http://twitter.com"" rel=""nofollow"">Twitter Web Client</a>","checkmybus_com",0,FALSE,FALSE,NA,NA,"2016-04-22","11:05:11"
"1483","Willie Burton of @megabus NYC with the daughter also named Dominique-- this guy just made my entire life! @megabus where can I give a review",FALSE,0,NA,2016-04-22 11:01:00,FALSE,NA,"723466629972111360",NA,"<a href=""http://twitter.com/download/iphone"" rel=""nofollow"">Twitter for iPhone</a>","indienik",0,FALSE,FALSE,NA,NA,"2016-04-22","11:01:00"
"1484","Currently sobbing on the megabus watching @StaceyDooley new documentary on migrant children Ì†ΩÌ≤î",FALSE,0,NA,2016-04-22 10:59:22,FALSE,NA,"723466217755934720",NA,"<a href=""http://twitter.com/download/iphone"" rel=""nofollow"">Twitter for iPhone</a>","han_thorpe",0,FALSE,FALSE,NA,NA,"2016-04-22","10:59:22"
"1485","Miss eating greggs on the megabus",FALSE,0,NA,2016-04-22 10:48:56,FALSE,NA,"723463594759860224",NA,"<a href=""http://twitter.com/download/iphone"" rel=""nofollow"">Twitter for iPhone</a>","_rhiannonmoore",0,FALSE,FALSE,NA,NA,"2016-04-22","10:48:56"
"1486","@megabus @Delicatedream85 this is a great question. Please share the answer.",FALSE,0,"megabus",2016-04-22 10:36:34,FALSE,"723446415364624384","723460482062028800","30965315","<a href=""http://twitter.com/download/iphone"" rel=""nofollow"">Twitter for iPhone</a>","20001dc",0,FALSE,FALSE,NA,NA,"2016-04-22","10:36:34"
"1487","London calling (@ https://t.co/bEE5YNjzQk Sheffield Stop) https://t.co/Mezc8c61rg",FALSE,0,NA,2016-04-22 10:26:06,FALSE,NA,"723457846227120128",NA,"<a href=""http://foursquare.com"" rel=""nofollow"">Foursquare</a>","mohicanrunner",0,FALSE,FALSE,"-1.41302201","53.41649852","2016-04-22","10:26:06"
"1488","Berry smoothies are the best kinda smoothies! Hopefully I'll manage to keep this down on my 4-hour megabus journey ‚Ä¶ https://t.co/g1kcs64xEW",FALSE,1,NA,2016-04-22 10:18:19,FALSE,NA,"723455888686780416",NA,"<a href=""http://ifttt.com"" rel=""nofollow"">IFTTT</a>","NUTRiBULLETFans",0,FALSE,FALSE,NA,NA,"2016-04-22","10:18:19"
"1489","@bartenderjfc I STRONGLY recommend @megabus over @GreyhoundBus or their shill @BoltBus BUT Mega doesn't service Baltimore. Just White Marsh.",FALSE,0,"bartenderjfc",2016-04-22 10:10:47,FALSE,"723443419155181568","723453994136383488","2361895725","<a href=""http://twitter.com/download/iphone"" rel=""nofollow"">Twitter for iPhone</a>","KarsinXXX",0,FALSE,FALSE,NA,NA,"2016-04-22","10:10:47"
"1490","@megabus already 1h late and still 30min at least before arriving ... Any action to ask forgiveness ? #Shame #Lille",FALSE,0,"megabus",2016-04-22 10:09:59,FALSE,NA,"723453789508755456","30965315","<a href=""http://www.twitter.com"" rel=""nofollow"">Twitter for Windows</a>","grandfroid_",0,FALSE,FALSE,NA,NA,"2016-04-22","10:09:59"
"1491","@georgiaroza I know but me and James both need to renew our passports so it'll work out so much dearer. Go on https://t.co/rTteIfOwer x",FALSE,0,"georgiaroza",2016-04-22 10:07:39,FALSE,"723450420790616064","723453205061898240","586647800","<a href=""http://twitter.com/download/android"" rel=""nofollow"">Twitter for Android</a>","taylorgrayx",0,FALSE,FALSE,NA,NA,"2016-04-22","10:07:39"
"1492","Finally got a megabus that doesn't smell, charger works and I got a front seat to my self ‚ù§Ô∏è‚ù§Ô∏è‚ù§Ô∏è‚ù§Ô∏è‚ù§Ô∏è",FALSE,3,NA,2016-04-22 10:01:14,FALSE,NA,"723451587973287936",NA,"<a href=""http://twitter.com/download/iphone"" rel=""nofollow"">Twitter for iPhone</a>","beckysmithh",0,FALSE,FALSE,NA,NA,"2016-04-22","10:01:14"
"1493","@Delicatedream85 Hello, please follow and DM for assistance",FALSE,0,"Delicatedream85",2016-04-22 09:40:41,FALSE,"723419684586967040","723446415364624384","1731421530","<a href=""http://www.hootsuite.com"" rel=""nofollow"">Hootsuite</a>","megabus",0,FALSE,FALSE,NA,NA,"2016-04-22","09:40:41"
"1494","Three Hour Masturbation On Megabus Lands Man In Jail https://t.co/PmD3Z4Of3t https://t.co/CVZClPagyb",FALSE,1,NA,2016-04-22 09:38:53,FALSE,NA,"723445962463567872",NA,"<a href=""http://www.ajaymatharu.com/"" rel=""nofollow"">Tweet Old Post</a>","drboycewatkins1",0,FALSE,FALSE,NA,NA,"2016-04-22","09:38:53"
"1495","state of this radio station on this megabus not playing purple rain on repeat 24/7, have some goddamned respect",FALSE,4,NA,2016-04-22 09:25:41,FALSE,NA,"723442642348965888",NA,"<a href=""http://twitter.com/download/iphone"" rel=""nofollow"">Twitter for iPhone</a>","sphghtn",0,FALSE,FALSE,NA,NA,"2016-04-22","09:25:41"
"1496","@JanFreedman do we need a curator couch surfing group to make training accessible for those with no budget? #natsca2016 #megabus",FALSE,5,"JanFreedman",2016-04-22 09:21:20,FALSE,"723438373621231617","723441549514690560","351566257","<a href=""http://twitter.com/download/iphone"" rel=""nofollow"">Twitter for iPhone</a>","BonnieBeasties",0,FALSE,FALSE,NA,NA,"2016-04-22","09:21:20"
"1497","The Man is back today, finally; he's been away for weeks. He is sending me live updates from the megabus. We know how to live, we do Ì†ΩÌ∏≥",FALSE,8,NA,2016-04-22 09:18:22,FALSE,NA,"723440802324574208",NA,"<a href=""http://twitter.com/download/iphone"" rel=""nofollow"">Twitter for iPhone</a>","Lucy_Robinson",0,FALSE,FALSE,NA,NA,"2016-04-22","09:18:22"
"1498","Absolutely freezing waiting for the megabus to arrive‚ùÑÔ∏è‚ùÑÔ∏è‚ùÑÔ∏è",FALSE,1,NA,2016-04-22 09:14:11,FALSE,NA,"723439749550116864",NA,"<a href=""http://twitter.com/download/iphone"" rel=""nofollow"">Twitter for iPhone</a>","imbeccathanyou",0,FALSE,FALSE,NA,NA,"2016-04-22","09:14:11"
"1499","I was originally going via train but it's so much cheaper to go via megabus or national express but there's none that run at night ughhh",FALSE,0,NA,2016-04-22 08:42:10,FALSE,NA,"723431690643726336",NA,"<a href=""http://twitter.com"" rel=""nofollow"">Twitter Web Client</a>","Magibubble",0,FALSE,FALSE,NA,NA,"2016-04-22","08:42:10"
"1500","Need to visit home end of May... 3 hour train for ¬£45 or 7 hour 30 min megabus for ¬£3 back to Newcastle?",FALSE,2,NA,2016-04-22 08:33:03,FALSE,NA,"723429395889680384",NA,"<a href=""http://twitter.com/download/iphone"" rel=""nofollow"">Twitter for iPhone</a>","emilybfreya",0,FALSE,FALSE,NA,NA,"2016-04-22","08:33:03"
"1501","@cashcashfan1995 that way you me Sebastian and @Tiffanyyy_Marie can megabus together too",FALSE,0,"cashcashfan1995",2016-04-22 08:20:37,FALSE,"723349357647552512","723426265902927873","3039902003","<a href=""http://twitter.com/download/iphone"" rel=""nofollow"">Twitter for iPhone</a>","DjLukieG",0,FALSE,FALSE,NA,NA,"2016-04-22","08:20:37"
"1502","There is nothing more terrifying than 50 pensioners queuing to get on the megabus.",FALSE,1,NA,2016-04-22 08:10:39,FALSE,NA,"723423761530155008",NA,"<a href=""http://twitter.com/download/iphone"" rel=""nofollow"">Twitter for iPhone</a>","danyamackenzie",0,FALSE,FALSE,NA,NA,"2016-04-22","08:10:39"
